[
  {
    "id": "seize_control",
    "name": "Seize Control",
    "description": "Take control of a location adjacent to territory already controlled",
    "actor": {
      "kinds": [
        "npc",
        "faction"
      ],
      "minProminence": "recognized",
      "requiredRelationships": [
        "leader_of"
      ]
    },
    "actorResolution": {
      "type": "via_relationship",
      "relationshipKind": "leader_of",
      "targetKind": "faction"
    },
    "targeting": {
      "kind": "location",
      "exclude": {
        "existingRelationship": {
          "kind": "controls",
          "direction": "dst"
        }
      },
      "require": {
        "adjacentTo": {
          "relationshipKind": "adjacent_to",
          "actorControlsVia": "controls"
        }
      }
    },
    "outcome": {
      "relationships": [
        {
          "kind": "controls",
          "src": "resolved_actor",
          "dst": "target",
          "strength": 0.8
        }
      ],
      "descriptionTemplate": "seized control of {target.name}"
    },
    "probability": {
      "baseSuccessChance": 0.3,
      "baseWeight": 1,
      "pressureModifiers": [
        "conflict",
        "stability"
      ]
    },
    "enabled": false
  },
  {
    "id": "form_alliance",
    "name": "Form Alliance",
    "description": "Create alliance between factions that are not already allied or at war",
    "actor": {
      "kinds": [
        "npc",
        "faction"
      ],
      "minProminence": "recognized"
    },
    "actorResolution": {
      "type": "via_relationship",
      "relationshipKind": "leader_of",
      "targetKind": "faction"
    },
    "targeting": {
      "kind": "faction",
      "exclude": {
        "existingRelationship": {
          "kind": "allied_with",
          "direction": "both"
        }
      },
      "excludeMultiple": [
        {
          "existingRelationship": {
            "kind": "at_war_with",
            "direction": "both"
          }
        }
      ],
      "excludeSelf": true
    },
    "outcome": {
      "relationships": [
        {
          "kind": "allied_with",
          "src": "resolved_actor",
          "dst": "target",
          "strength": 0.7,
          "bidirectional": true
        }
      ],
      "descriptionTemplate": "forged alliance with {target.name}"
    },
    "probability": {
      "baseSuccessChance": 0.4,
      "baseWeight": 0.8,
      "pressureModifiers": [
        "conflict",
        "stability"
      ]
    },
    "enabled": false
  },
  {
    "id": "declare_war",
    "name": "Declare War",
    "description": "Create enemy relationship between factions",
    "actor": {
      "kinds": [
        "npc",
        "faction"
      ],
      "minProminence": "renowned"
    },
    "actorResolution": {
      "type": "via_relationship",
      "relationshipKind": "leader_of",
      "targetKind": "faction"
    },
    "targeting": {
      "kind": "faction",
      "exclude": {
        "existingRelationship": {
          "kind": "at_war_with",
          "direction": "both"
        }
      },
      "excludeSelf": true
    },
    "outcome": {
      "relationships": [
        {
          "kind": "at_war_with",
          "src": "resolved_actor",
          "dst": "target",
          "strength": 0.9,
          "bidirectional": true
        }
      ],
      "pressureChanges": {
        "conflict": 10
      },
      "descriptionTemplate": "declared war on {target.name}"
    },
    "probability": {
      "baseSuccessChance": 0.6,
      "baseWeight": 0.5,
      "pressureModifiers": [
        "conflict",
        "stability"
      ]
    },
    "enabled": false
  },
  {
    "id": "raid",
    "name": "Raid",
    "description": "Attack an enemy faction",
    "actor": {
      "kinds": [
        "npc",
        "faction"
      ]
    },
    "actorResolution": {
      "type": "via_relationship",
      "relationshipKind": "leader_of",
      "targetKind": "faction"
    },
    "targeting": {
      "kind": "faction",
      "require": {
        "hasRelationship": {
          "kind": "at_war_with",
          "direction": "src",
          "fromResolvedActor": true
        }
      }
    },
    "outcome": {
      "relationships": [
        {
          "kind": "enemy_of",
          "src": "actor",
          "dst": "target",
          "strength": 0.8
        }
      ],
      "pressureChanges": {
        "conflict": 5
      },
      "descriptionTemplate": "raided {target.name}"
    },
    "probability": {
      "baseSuccessChance": 0.35,
      "baseWeight": 1,
      "pressureModifiers": [
        "conflict",
        "external_threat"
      ]
    },
    "enabled": false
  },
  {
    "id": "establish_trade",
    "name": "Establish Trade Route",
    "description": "Create trade connection between two thriving locations",
    "actor": {
      "kinds": [
        "npc",
        "faction"
      ]
    },
    "targeting": {
      "kind": "location",
      "statuses": [
        "thriving"
      ],
      "selectTwo": true,
      "exclude": {
        "existingRelationship": {
          "kind": "trades_with",
          "direction": "both"
        }
      }
    },
    "outcome": {
      "relationships": [
        {
          "kind": "trades_with",
          "src": "target",
          "dst": "target2",
          "strength": 0.6,
          "bidirectional": true
        }
      ],
      "pressureChanges": {
        "resource_scarcity": -5
      },
      "descriptionTemplate": "established trade route between {target.name} and {target2.name}"
    },
    "probability": {
      "baseSuccessChance": 0.5,
      "baseWeight": 1.2,
      "pressureModifiers": [
        "resource_scarcity",
        "stability"
      ]
    },
    "enabled": false
  },
  {
    "id": "corrupt_location",
    "name": "Corrupt Location",
    "description": "Spread magical corruption to a location",
    "actor": {
      "kinds": [
        "npc",
        "abilities"
      ],
      "requiredRelationships": [
        "practitioner_of"
      ],
      "requiredPressures": {
        "magical_instability": 50
      }
    },
    "actorResolution": {
      "type": "via_relationship",
      "relationshipKind": "practitioner_of",
      "targetKind": "abilities",
      "requireSubtype": "magic"
    },
    "targeting": {
      "kind": "location",
      "exclude": {
        "existingRelationship": {
          "kind": "corrupted_by",
          "direction": "src"
        }
      }
    },
    "outcome": {
      "relationships": [
        {
          "kind": "resident_of",
          "src": "target",
          "dst": "resolved_actor",
          "strength": 0.7
        }
      ],
      "pressureChanges": {
        "magical_instability": 5
      },
      "descriptionTemplate": "corrupted {target.name}"
    },
    "probability": {
      "baseSuccessChance": 0.25,
      "baseWeight": 0.8,
      "pressureModifiers": [
        "magical_instability"
      ]
    },
    "enabled": false
  },
  {
    "id": "manifest_magic",
    "name": "Manifest Magic",
    "description": "Magic manifests at a location",
    "actor": {
      "kinds": [
        "abilities"
      ],
      "subtypes": [
        "magic"
      ]
    },
    "actorResolution": {
      "type": "self"
    },
    "targeting": {
      "kind": "location",
      "exclude": {
        "existingRelationship": {
          "kind": "manifests_at",
          "direction": "dst"
        }
      }
    },
    "outcome": {
      "relationships": [
        {
          "kind": "manifests_at",
          "src": "actor",
          "dst": "target",
          "strength": 0.8
        }
      ],
      "descriptionTemplate": "manifested at {target.name}"
    },
    "probability": {
      "baseSuccessChance": 0.3,
      "baseWeight": 1,
      "pressureModifiers": [
        "magical_instability"
      ]
    },
    "enabled": false
  },
  {
    "id": "spread_innovation",
    "name": "Spread Innovation",
    "description": "Technology spreads to new practitioners",
    "actor": {
      "kinds": [
        "abilities"
      ],
      "subtypes": [
        "technology"
      ]
    },
    "actorResolution": {
      "type": "self"
    },
    "targeting": {
      "kind": "npc",
      "statuses": [
        "alive"
      ],
      "exclude": {
        "existingRelationship": {
          "kind": "practitioner_of",
          "direction": "dst"
        }
      }
    },
    "outcome": {
      "relationships": [
        {
          "kind": "practitioner_of",
          "src": "target",
          "dst": "actor",
          "strength": 0.6
        }
      ],
      "pressureChanges": {
        "magical_instability": -2
      },
      "descriptionTemplate": "spread to {target.name}"
    },
    "probability": {
      "baseSuccessChance": 0.4,
      "baseWeight": 1,
      "pressureModifiers": [
        "resource_scarcity",
        "magical_instability"
      ]
    },
    "enabled": false
  },
  {
    "id": "convert_faction",
    "name": "Convert Faction",
    "description": "Spread cultural/religious belief to faction",
    "actor": {
      "kinds": [
        "npc"
      ]
    },
    "actorResolution": {
      "type": "via_relationship",
      "relationshipKind": "weaponized_by",
      "targetKind": "rules"
    },
    "targeting": {
      "kind": "faction",
      "exclude": {
        "existingRelationship": {
          "kind": "member_of",
          "direction": "src",
          "toResolvedActor": true
        }
      }
    },
    "outcome": {
      "relationships": [
        {
          "kind": "practitioner_of",
          "src": "target",
          "dst": "resolved_actor",
          "strength": 0.7
        }
      ],
      "pressureChanges": {
        "cultural_tension": -5,
        "stability": 3
      },
      "descriptionTemplate": "converted {target.name} to {resolved_actor.name}"
    },
    "probability": {
      "baseSuccessChance": 0.3,
      "baseWeight": 1,
      "pressureModifiers": [
        "cultural_tension",
        "stability"
      ]
    },
    "enabled": false
  },
  {